Game,Author,Outlet,URL,Review
Resident Evil 2,Andy Kelly,PC Gamer,https://www.pcgamer.com/resident-evil-2-review/,"When you purchase through links on our site, we may earn an affiliate commission. Here’s how it works.A tense, challenging, and beautiful remake of a classic survival horror game, and with enough fresh ideas to make it feel excitingly new.PC Gamer's got your back 


Our experienced team dedicates many hours to every review, to really get to the heart of what matters most to you. Find out more about how we evaluate games and hardware.What is it? A remake of the best PlayStation-era Resi game.
Expect to pay £45/$60
Developer Capcom
Publisher In-house
Reviewed on GTX 1080, Intel i5-6600K, 16GB RAM
Multiplayer None
Link Official site (opens in new tab)
Buy it Humble (opens in new tab) / Steam (opens in new tab)One of the most remarkable things about this Resident Evil 2 remake is that it makes zombies—the slow, shambling, groaning kind—exciting again. The undead in this game are incredible, horrible things: shuffling lumps of bloody meat who batter down doors, tumble through broken windows, and lunge hungrily from the shadows. They're physical and clumsy and an absolute joy to kill—if you have the ammunition to spare.Shoot a leg off and they keep coming, dragging themselves along the floor, reaching at you with pale, clawing hands. Turn a corner, and as your flashlight beam catches their glassy white eyes they screech and trudge towards you, arms outstretched, jaws slung with glistening blood. They don't sprint or explode or sprout thrashing parasites like they do in newer Resident Evil games. They just moan and lurch and grab, and there's something enjoyably back-to-basics about that—a feeling that echoes through every claustrophobic hallway of this confident remake.After the subversive, rule-breaking Resident Evil 7 (opens in new tab), with its grimy Southern Gothic aesthetic and intimate first-person horror, Resident Evil 2 is a return to a more familiar style of game. It's a remake, but it's never a slave to the source material, adding or cleverly remixing enough elements to make it feel brand new. You can still play as two characters—Leon S. Kennedy and Claire Redfield—and a few fan favourite bosses and locations have been recreated. But even moments of fan service are given some kind of interesting twist or fresh angle, which is, honestly, not what I expected from this remake at all.Graphics options Anti-aliasing (FXAA/TAA/FXAA+TAA/SMAA), texture quality, texture filter quality (anisotropic 2-16x), subsurface scattering, contact shadows, screen space reflections, particle lighting quality, ambient occlusion (SSAO limited/SSAO full/HDAO/HBAO+), motion blur, graphics API (DX11/DX12)Performance With a GTX 1080, 16GB of RAM, and an i5-6600K overclocked to 4.0GHz I was able to play Resident Evil 2 at 1440p/60fps on almost max settings, and it ran smoothly—albeit with some judder when sprinting into a large, open area such as the RPD main hall.The grand, imposing Raccoon City Police Department was always a great setting, but the shift to three dimensions makes it magnificent. While the original game relied on fixed camera angles and the distant moan of unseen zombies to build fear, the remake uses light, shadow, and layout to get under your skin. Some parts of the station have been plunged into darkness, forcing you to pick through the gloom with a flashlight. The building itself is a labyrinth of blind corners, shadowy recesses, and warren-like corridors, creating a constant feeling of apprehension and unease.The station is essentially a giant box of puzzles, and an absence of objective markers, beyond a few marked points of interest, means you have to draft a mental map as you play. At first most of the building is locked up tight, or obstacles such as the burning wreck of a crashed helicopter block the way forward. But as you explore you find items that let you delve deeper, and slowly but surely the maze of halls, offices, atriums, and stairwells starts to feel familiar. I also like how dead zombies stay put, even after reloading a save, as I'd often use their corpses as a kind of macabre breadcrumb trail.But navigating the station and deciphering its many riddles and puzzles is only half the battle. The zombies, as much fun as they are to scrap with, can take a hell of a beating. Their health seems to be randomised, meaning that you can empty ten bullets into one and it'll keep crawling after you, while another will be put down permanently by just a few shots. And whichever dice roll governs the chance of an explosive headshot is weirdly stingy. This makes the zombies unpredictable and tenacious, as zombies should rightly be. But it also teaches you a hard lesson that every bullet in this remake is precious, and if you can slip past an enemy rather than killing it, you probably should.Then there's the Tyrant, a hulking great mutant in a trench coat (and a hat, which you can shoot off) for whom gunfire is little more than a minor inconvenience. At certain points in the game this merciless, invincible killing machine will hunt you around the station with grim persistence. You can track his movements by listening to the heavy thud of his footsteps, but other than blinding him with a flashbang, evasion is your only real option. He's also attracted to gunfire, which adds further weight to decisions involving fighting regular zombies. Do you waste ammo and risk alerting the Tyrant?Ink ribbons? ✓
But only on the hardcore difficulty setting. Saves are free in the other modes, but save too often and it affects your final rank.Item boxes? ✓
They work the same way they always have, letting you magically access your stockpile of items from multiple locations.Bonus modes? ✓
Versions of Fourth Survivor and Tofu Survivor, starring Hunk and a block of tofu respectively, are unlockable in the remake.Loading doors? X
You don't have to watch a door slowly opening every time you move into a new room: it's all completely seamless now.Fixed camera angles? X
The whole game is third-person, similar to Resident Evil 4, but that doesn't make exploring the RPD building any less tense.Original music? X
The remake has its own new score, but if you buy the 'Deluxe Edition' you get the option to replace it with the classic tunes.The way he walks slowly towards you, unflinching and emotionless, is genuinely unsettling—especially when he suddenly appears at the end of a long corridor. And he's always lurking near items you need to progress, which is brilliantly cruel. But I would have liked more ways to interact with him, because eventually these run-ins start to feel rather one-note, and the fear can mutate into frustration. Even the ability to throw something to distract him would have made these sections more interesting, but as it stands the concept feels underdeveloped.Similar to Resident Evil 4, the difficulty of the game adapts as you play. How it actually works is obscured, but whatever's going on behind the scenes, the balancing is quite masterful. For the entire nine hours it took me to finish my first run as Leon, I felt constantly on the verge of catastrophic failure. I always had a handful of bullets, little or no health items, and I kept wondering if I'd backed myself into an inescapable rut. But I'd always scrape through, and it's hugely impressive how the game managed to maintain this knife-edge tension from start to finish.The good news is that if you sacrifice ammo to clear an area, it'll stay clear. More zombies can spill through open windows, but you can block these up with wooden boards. This gives you some breathing room, especially when you're being chased by the Tyrant. The last thing you need is zombies clawing at you when you're trying to run to safety. Counter-weapons can also tip the balance. If you have a grenade or a combat knife in your inventory and something grabs you while you're low on health, you'll avoid death: stabbing them with the blade or shoving a grenade in their mouth. So the game isn't completely relentless in its attempts to sabotage you, but for every inch it gives you, it rudely snatches one right back.It's never really that scary, though. Unnerving, tense, and sometimes overwhelmingly stressful, sure, but there's nothing particularly understated or psychological about it. But that was always Resident Evil's thing: zombie dogs crashing loudly through windows rather than the psycho-sexual mind-beasts of Silent Hill. Still, Resident Evil 7 had some effectively surreal, eerie moments, and I would have liked some of that to make its way into this remake. If you can't deal with the stress, there is an 'assisted' difficulty option that adds generous auto-aim and makes a small amount of health regenerate automatically. But, honestly, the game just isn't very exciting when your item box is heaving with an abundance of spare shotgun shells and healing herbs.As an evolution, and a celebration, of vintage Resident Evil, you couldn't ask for much moreWhen you finish your first playthrough, you've really only seen half of what the game has to offer. The second uses the same locations and has many of the same story beats, but the puzzles are different, enemy types and locations are mixed up, and you take a different route through each of the game's three major locations. What I love about this so-called 'B' scenario is how the game uses your knowledge of the setting against you. Walking into the RPD main hall as Claire, a protected haven for Leon, and seeing zombies in there was a fun subversion. It's just a shame the intensity of the Tyrant is amped up to such a preposterous degree. He's constantly looming over your shoulder, which I ultimately found a bit annoying.As a longtime fan of the original Resident Evil 2, I enjoyed the remake's many self-aware attempts to clarify some of the more abstract stuff in the game—such as why a sewer system is powered by plugs shaped like chess pieces, or why a police station would inexplicably theme its keys and locks around playing card suits. There are other cute references to the old games to find as well, but they're pretty subtle and don't feel forced. This could have easily been a game targeted squarely at diehard fans, but if this is your first Resident Evil you could get your head around everything in minutes—another example of how refreshingly simple the remake is. The story is really no more complicated than: zombies everywhere, get to safety. Which makes even the relatively pared-down narrative of Resident Evil 7 seem overly complex.Some of the voice acting and writing are pretty bad, and not 'fun bad' like in the old PlayStation games: just regular bad. The second act, which takes place in a dingy sewer, slows the action down to a crawl. And I was glad when the section where you play as Ada Wong, solving hacking puzzles while the Tyrant stalks you, was over. But otherwise, this is pretty much the ultimate refinement of the classic Resident Evil formula—but with the added intensity of RE4's slick, dynamic over-the-shoulder combat. The result is a game that is comfortably among the best in the series, and a thrilling survival horror experience in its own right. It's not as surprising as RE7, but as an evolution, and a celebration, of vintage Resident Evil, you couldn't ask for much more.A tense, challenging, and beautiful remake of a classic survival horror game, and with enough fresh ideas to make it feel excitingly new.If it’s set in space, Andy will probably write about it. He loves sci-fi, adventure games, taking screenshots, Twin Peaks, weird sims, Alien: Isolation, and anything with a good story.Resident Evil 2 and 3 have quietly had their ray tracing options removedOriginal versions of Resident Evil remakes return to Steam after 'overwhelming community response'The Gollum collector's edition really is called the 'Precious Edition'By Phil Iwaniuk6 April 2023By Dave James5 April 2023By Kizito Katawonga4 April 2023By Jacob Ridley4 April 2023By Ian Evenden4 April 2023By Jorge Jimenez3 April 2023By Luke Winkie3 April 2023By Ted Litchfield31 March 2023By Robin Valentine31 March 2023By Katie Wickens31 March 2023By Dave James30 March 2023PC Gamer is part of Future plc, an international media group and leading digital publisher. Visit our corporate site (opens in new tab).©
Future Publishing Limited Quay House, The Ambury,
Bath
BA1 1UA. All rights reserved. England and Wales company registration number 2008885. "
Resident Evil 2,Aoife Wilson,Eurogamer,https://www.eurogamer.net/articles/2019-01-22-resident-evil-2-review,"Raccoon tale.You know you're playing a good Resident Evil game when you need to keep a pen and a piece of scrap paper close at hand. Sitting on the first open page of my notepad, in a frantic scrawl, are rudimentary diagrams with numbers sticking out at odd angles, repeating three letter codes, bizarre rune patterns, abbreviated riddles, safe-cracking combinations, random running tallies, and then sometimes just the odd word, number or phrase followed with a bemused question mark. Lion statue? Stained glass? Locker room? Keypad? This is the frenzied, stream of consciousness-style note-taking of someone deep down a Resident Evil rabbit hole. As an old-school Resident Evil fan, I couldn't be happier. Calling this modern Resident Evil 2 a remake feels like an undersell. Yes, it's a faithful recreation of the 1998 survival horror classic, but it has been rebuilt completely from the ground up, resurrecting iconic locations like the Raccoon City Police Station using Resident Evil 7's RE Engine. And the RPD has never looked better. From the detailed character models and animations to the way your quivering torchlight illuminates the glistening entrails of what used to be a cop, this game looks incredible. Certain elements of the art museum-turned-police station have been reshuffled and reimagined to make sense in a photorealistic environment and for a modern audience, but though this is not the police station as it was in the original Resident Evil 2, it's the police station as you remember it. A grand gilded entrance hall making way for a dozen twisted corridors and antechambers, layered and meted out through keys and trinkets that only get more bizarre as the story continues. The zombies and the corporate espionage are all well and good, but the original game was memorable in a good part due to the station's starring role as both your place of refuge and your prison. Despite the change from fixed camera angles to a third-person over the shoulder perspective, it's a testament to the layout that locations still manage to be both claustrophobic and oppressive. Even the larger, more open spaces like the main police station reception aren't wasted, as these are often put to use by giving you line of sight to a pursuing enemy as you try to shake them on your way through to another interconnecting hallway. You do get a good feel for where everything is after a few loops around the building, but even veteran players would be lost without the map screen, which mercifully logs all the most pertinent information as you play, including the locations of items you've seen but haven't picked up, safes or lockers you've yet to crack open, windows you've boarded and doors that have yet to be unlocked, along with which key or item you need to open them up. It's one of the places the game's lineage shines through most and you're going to need to get on board with the micromanagement of it all - regularly casting back to your map screen, flipping through in-game files, opening up your inventory to examine items and find clues as to their usefulness. A feature that very much comes in handy but in hindsight I think I relied upon a little too much is the game's habit of marking a room red on the map when it still has secrets for you to uncover, and blue once you've squeezed it for every last item or ammo clip it's hiding. You can get into a bad habit of constantly flipping back and checking the status of this colour-co-ordination on the map screen instead of simply exploring things at your own pace, but it's also worth bearing in mind that files and various other reading materials are often crucial for seeing Resident Evil's bigger picture, and these do not show up on the map in any shape or form - you just have to keep your eyes peeled for them yourself. No matter how well you explore, how many enemies you defeat and how many puzzles you solve, however, the game will still have more surprises up its sleeve by the time you first see the credits roll. Upon starting your game of Resident Evil 2, you'll be asked which character you'd like to play as - rookie cop Leon S. Kennedy or obscenely capable college student Claire Redfield. Seeing the campaign through as either one or the other, you'll be meeting unique characters, fighting different enemies and wielding specialist weapons. Upon completing that campaign, you'll be prompted to begin a New Game '2nd Run,' a follow-up scenario featuring the other character where the ending and certain parts of the game have been changed. It's only after completing this second run that you'll get the 'true ending' of the game, and after this second play through you'll also unlock The Fourth Survivor mode and the 2nd Run scenario for your first character. So, just like the original Resident Evil 2, you can play up to four full length campaigns with varying enemy placements and puzzle solutions every time. The story beats don't vary wildly between first and second run-throughs with the same characters (and the locations don't really vary at all), but there are subtle differences here and there. Combine this with additional challenges to unlock bonus assets and artwork and a hardcore difficulty featuring stronger enemies and the need to use an ink ribbon consumable item to save, means there's plenty to keep classic Resident Evil fans coming back for third or fourth helpings. For reference, it took me roughly seven hours to complete both my first and second campaign, first as Claire and then as Leon. The divergent story paths will take you through pretty much the exact same areas, particularly in the latter half of the game, but Resident Evil 2 makes sure to switch up the gameplay with different weapons, different key item placements and different puzzle solutions. Most situations, in other words, will not be exactly as you first experienced them (except for, oddly, safe code combinations, which carry over wholesale into 2nd run playthroughs). Both Claire and Leon's scenarios flesh out their individual storylines, but in a new addition to this retelling both Ada Wong and Sherry Birkin are playable for short sections this time around during Leon and Claire's campaigns respectively. Ada's sequence is a little more involved than her playable section in the original game and features a unique hacking gadget that sounds great in theory but isn't all that fun to wield, while Sherry plays an elaborate game of Hide and Seek in a spooky orphanage - as if there's any other kind. These are only very brief detours from the main campaigns they feature in and mechanically, each is very hit and miss in its own way, and yet they both serve as a welcome palate cleanser and quick change of pace to the central campaign. Playing as Claire and Leon, your time is split between navigating your way around and away from lunging enemies, exercising an itchy, tasty trigger finger when necessary and using your capable yet delicious brains to advance deeper into the city of the dead. As a practiced zombie-killer, I of course know that the fastest way to an efficient kill is with a headshot, but often, even with the most basic fodder in Resident Evil 2, one or even two headshots isn't enough to bring them down permanently. This means that even on standard difficulty, you'll soon find that there are far more enemies than you have bullets, so often you may have to swallow your pride and simply run away. If the zombie is somewhere you'll be passing through with any kind of regularity, however, like a police station thoroughfare, you'll want to at least immobilise them to an extent, by taking off their legs and/or arms.There's a definite sadistic pleasure to be had in this, too - as satisfying as it is to land a perfect headshot right between the eyes, the act of popping off a zombie's limbs one by one and seeing them fall with a wet slop onto the polished marble floor of the police station reception offers its own grim fun. It's a small act of genius that this game allows you to move and shoot, as you'd expect from any modern third person action title, but in a subtle callback to the game's survival horror roots, shooting is refined this time out in that by standing still for a few seconds, the reticule tightens to a pinpoint and you become far more accurate. It's a way of honouring the series' past without sacrificing the kind of gunplay we're used to in 2019, and this Resident Evil 2 is filled with similar smart tweaks, where things have been refined and reframed, but the spirit of survival horror is left very much intact.Of course, with some enemies, running is and was always the only option. The Tyrant T-00 (just like in the original, he's never referred to as Mr X in-game) is a formidable foe, but he won't stalk you for the entirety of Resident Evil 2, as some players initially feared. There are certain portions he'll show up for and certainly stress you out during, but this mechanic doesn't outstay its welcome, nor does it definitively block curious players from exploring every inch of the RPD at their own leisure. He's still a horribly imposing and unpredictable presence, though there are moments it does feel unfair that when cornered by him in a dead-end corridor, there's no way to avoid him taking a swing at you other than unloading a couple of bullets into his head to momentarily stun him. Part of Resident Evil's challenge is weighing up the risk versus reward of travelling back through an infested area knowing full well that you may well end up having to use a healing item or spend more bullets than you can technically afford. That is, of course, part of the game's long-lasting appeal and though this Resident Evil 2 is a beautiful and at times incredibly modern-feeling game, beneath its new and impeccably polished trappings you can still feel the beating heart of the classic and increasingly aged framework it's built on. But that framework is precisely what made the original Resident Evil 2 such a stone cold classic, and though some story beats have been streamlined and some gameplay mechanics have been embellished or added to, this is a reimagining that sticks remarkably close to its source material. Even better, it toes the line between schlocky and scary that the older Resident Evil games managed so well, and does so in perhaps one of the most atmospheric settings ever to grace a survival horror game. It's good to be back in the RPD. Just be sure to bring a pen and paper with you. You're not signed in!Create your ReedPop ID & unlock community features and much, much more!
Find out how we conduct our reviews by reading our review policy.    Get the day's most talked about stories straight to your inbox.
Aoife Wilson

          Head of Video
        Aoife is a writer, video producer and TV presenter. Also Khaleesi, though legally speaking she owns no land, army or dragons. Yet.
Please enable JavaScript to see comments.      

 Capcom quietly removes raytracing from Resident 2 and 3 Remakes                    


 Monster Hunter Rise sales surpass 11m units                    


 Resident Evil 2 Remake has now sold over 10m copies                    



Digital Foundry |

 Resident Evil's new PC patches compromise visuals and hit performance hard                    



Digital Foundry |

 Resident Evil 2/3 Remake: PlayStation 5 and Xbox Series upgrades tested                    


 Capcom reactivates previous versions of Resident Evil PC games after ""overwhelming community response""                    


 Resident Evil 2, 3, and 7 minimum requirements raised on PC following new patch                    



Feature |

 Everything revealed in the Capcom showcase                    



Review |

 Minecraft Legends review - a messy spinoff that misses the point of Minecraft                    



Digital Foundry |

 Nvidia GeForce RTX 4070 review: an RTX 3080 challenger for $599                    



Review |

 Road 96: Mile 0 review - a loveable tangle of concepts and moods                    



Digital Foundry |

 AMD Ryzen 7 7800X3D review: faster than 13900K and 7950X3D for gaming?                    



Review |

 Super Mario Bros. Movie review - an entertaining advert for everything Nintendo                    



Recommended |

 Paranormasight: The Seven Mysteries of Honjo review - spooky goings on in Tokyo                    



Recommended |

 Terra Nil Review - an intricate ecosystem of puzzles                    



Review |

 Dredge review - a clever fishing sim, but an underwhelming horror game                    
Buy things with globes on themAnd other lovely Eurogamer merch in our official store!Bad puns and video games since 1999.Eurogamer.net is owned by Gamer Network Limited, a ReedPop company and subsidiary of Reed Exhibitions Limited.© 2023 Gamer Network Limited, Gateway House, 28 The Quadrant, Richmond, Surrey, TW9 1DN, United Kingdom, registered under company number 03882481.All rights reserved. No part of this website or its content may be reproduced without the copyright owner's permission."
