Game,Author,Outlet,URL,Review
Resident Evil 2,Jeff Grubb,GamesBeat,https://venturebeat.com/2019/01/22/resident-evil-2-review/,"Connect with top gaming leaders in Los Angeles at GamesBeat Summit 2023 this May 22-23. Register here.I have enough stress in my life. I’m a parent to a young kid. We’ve got another one arriving any minute now. The future seems uncertain, and every moment feels like things are only getting more out of control. So I don’t go looking for more stress. And that would be a problem for a tense horror game, but somehow Capcom’s Resident Evil 2 remake is getting by just fine.Resident Evil 2 is the latest entry in the long-running survival-horror franchise. It is due out January 25 on PC (reviewed), PlayStation 4, and Xbox One, and it is a complete reimagining of the original 1998 PlayStation release.Capcom retained the setting, characters, and basic story of the original, but the publisher also incorporated elements from other games in the series. Resident Evil 2 uses the same RE Engine that powered the atmospheric and beautiful Resident Evil 7. And like Resident Evil 4, this remake uses an over-the-shoulder camera perspective to put you closer to the action.The result is a Resident Evil that is scary but also packed with excitement.GamesBeat Summit 2023Join the GamesBeat community in Los Angeles this May 22-23. You’ll hear from the brightest minds within the gaming industry to share their updates on the latest developments.Resident Evil 2 introduces a hacking tool to solve puzzles about halfway through. At the same time, it strips many of your weapons away from you and handcuffs your ammunition. This makes you vulnerable, and in this part of the game, a massive enemy makes regular attacks against you.With almost no ammo, I began putting three bullets into the thighs of every zombie. This strategy causes their leg to fall off, which slows them to a literal crawl. That gave me enough time to solve the puzzle in the room and move along.That’s when two things happened: I found a locked door. And the large boss-style enemy showed up right behind me.I only had 9 rounds. So I aimed down sights and waited for my reticle to shrink to ensure accuracy. It was a tense moment, trying to line up the shot with the over-the-shoulder perspective and the enemy barreling straight at me. But when I had everything just right, I unleashed 9 rounds right into the behemoth’s face.Above: Resident Evil 2 is extremely beautiful at times, and it is always moody and atmospheric.Somehow, I had just enough bullets to stagger the giant. It didn’t kill him, but it stopped his progress. That gave me just enough time to remember I had a door to unlock. I pulled out my hacking tool and got through just as the monster was getting back to his feet.This encounter is indicative of everything that Resident Evil 2 is great at. It’s horrifying. I was scared. But the solution wasn’t just to run away or hide. I had to fight back just long enough to create an opportunity to escape.Capcom struck an ideal balance between horror and action, and that is why this remake works so well. Yes, it is stressful. I would almost call it too stressful for a fragile guy like me. But the fights give you just enough space to punch back that you feel like you can create some breathing room.Resident Evil 4 is still my favorite in the series. I prefer action over horror. But where Resident Evil 4 has a lot of variety in its action, Resident Evil 2 remake keeps things fresh on multiple different levels. And it is better than any other in the series at serving all of Resident Evil’s disparate audiences.If you’re here for the lore and characters, Resident Evil 2 nails it. Are you looking for a zombie game with modern graphical tech, Capcom’s got you. If you want something that is intense and full of action, this is a bingo.Above: Leon Kennedy is not Rick Grimes.But Resident Evil 2 also plays all of its various aspects off of one another really well. It has bigger and badder enemies to break up the monotony of the slow-moving zombies. And to break up that combat, it has the charming old-school puzzle design where you open secret passages with a medallion. It is a smart game for modern players who are looking for multifaceted gaming experiences.Aiming and firing your weapon in Resident Evil 2 feels nice. But moving your character around the world is still a bit awkward. It is a huge improvement over the tank controls from the early games, but I still find myself struggling to get my character to move exactly where I want. And that’s a problem when it results in a zombie getting close enough to give me a nip on the neck.I also found myself opening up my map every five steps at a number of points in the game. The dark police station is tough to navigate. And just as you get the hang of things, it opens up a new area. And when something giant and impervious chases you, you don’t want to go down a dead end or anything.Resident Evil 2 isn’t as scary as I was expecting. It is stressful, but it’s not the nonstop nightmare fuel that Resident Evil 7 was.It is still stressful, but most of that comes from a sort of situational horror. Almost any game would cause you stress if you had to make it from one side of the map to the other with a wounded character, no health items, and 2 rounds in your weakest hand gun.Above: A metaphor … probably for the president or something.The zombies, the lickers, and the rest of Resident Evil 2’s cast of undead just don’t frighten me much anymore. I’m probably just desensitized at this point, but I was expecting Capcom to do more.Resident Evil 2 is going to click with a lot of people, and those folks are going to love it. I still really enjoy it even if it didn’t fully click with me. But my issues with this game are just a matter of taste and not execution. I prefer the Resident Evil 4 style where I have enough ammo to just blast my way out of every situation.But what’s great about Resident Evil 2 is that it’s still a really fun and well-made experience even when it drives someone like me out of their comfort zone. That’s the sign of a strong game.Finally, Capcom has put a lot of game into Resident Evil 2. It has four remixed campaigns — two each for the playable characters Leon and Claire. But Capcom has also revealed plans to add even more. That includes a mode that randomizes where items are as well as new player characters.It’s a good time to be a Resident Evil fan again.Score: 85/100Resident Evil 2 hits PC, Xbox One, and PlayStation 4 on January 25. Capcom provided a download code for the purpose of this review. GamesBeat's creed when covering the game industry is ""where passion meets business."" What does this mean? We want to tell you how the news matters to you -- not just as a decision-maker at a game studio, but also as a fan of games. Whether you read our articles, listen to our podcasts, or watch our videos, GamesBeat will help you learn about the industry and enjoy engaging with it. Discover our Briefings.Calling all gaming execs! Join us for the 15th annual GamesBeat Summit in Los Angeles on May 22-23.© 2023 VentureBeat. All rights reserved."
Resident Evil 2,Chad Sapieha,Post Arcade (National Post),https://business.financialpost.com/technology/gaming/resident-evil-2-review-capcom-delivers-a-masterclass-in-how-to-do-a-remake-right," One of the best survival horror adventures ever released gets the royal remake treatment in 2019's first must-play game Score: 9.5/10  Platform: PlayStation 4 (reviewed), Xbox One, Windows PC Developer: Capcom Publisher: Capcom Release Date: January 25, 2019 ESRB: MSubscribe now to read the latest news in your city and across Canada.Subscribe now to read the latest news in your city and across Canada.Create an account or sign in to continue with your reading experience.Don't have an account?  Create Account In this humble player’s opinion, few games are more deserving of a big-budget remake than Resident Evil 2 – and not just because I indirectly credit it for my choice of career, where I live and even my family (a long story for another column).With its bar-raising graphics, brilliantly schlocky B-movie tropes, and deftly crafted atmosphere and pacing, the original 1998 game helped define what the nascent genre of survival horror would be for decades to come. Leon and Claire’s pulse-pounding adventure through Raccoon City’s zombie-infested streets, police department, sewers and hidden laboratories stands as a staunch and undeniable classic in the medium of interactive entertainment.Sign up to receive the daily top stories from the Financial Post, a division of Postmedia Network Inc.A welcome email is on its way. If you don't see it, please check your junk folder.The next issue of Financial Post Top Stories will soon be in your inbox. We encountered an issue signing you up. Please try again The problem with games, though, is that they don’t age very well. Unlike movies, music and books, revisiting a game released 20 or more years ago is often a painful experience, as our modern gaming sensibilities are forced to contend with antiquated technology.Case in point: Resident Evil 2‘s presentation, while outstanding for its era – I actually remember telling my friends at the time that it was so lifelike that I felt like I was playing a film – is now laughably outdated. More than that, it has clunky controls, terrible aiming, annoying loading screens between every room, a frustratingly restrictive camera … the list goes on.The none-too-easy task assigned Capcom’s remake team was to keep everything that players loved about the original while cutting or improving everything else. They had to give us the game we remember through rose-coloured glasses, not the one we actually played.And, by golly, that’s exactly what they’ve done.2019’s Resident Evil 2 captures the vibe of the original perfectly, thanks largely to outstanding production values.Its visual design stands toe-to-toe with any contemporary work, with fantastic character models, dramatic motion capture performances and extraordinarily detailed and refined environment design. Just about everything is worth looking at a second or third time, either to catch a potential game clue or simply to appreciate its beauty.The audio is just as impressive, featuring a talented cast, wonderfully creepy ambient sounds that help make you feel like water is pattering on tile in your living room or fire is burning in the next room, and a minimalistic but powerful score that always rears its terrifying head at just the right time to send one’s pulse racing and make you wish you hadn’t switched off the lights.It’s the tweaks to how the game plays, however, that show just what a careful and loving a hand was applied to remaking this beloved work of interactive art.The restrictive camera is gone, replaced by an over-the-shoulder perspective that feels natural by modern standards but still allows for the sort of tight direction and jump scares inherent to the Resident Evil experience. And Capcom’s gamesmiths have managed to keep the original’s stop, pivot and aim shooting mechanics – something I’ve always felt was far more realistic than the running and gunning found in most games – while adjusting movement and targeting so that it feels natural and unrestricted. I felt empowered to track and aim at both lumbering and fast-moving enemies.And by eliminating virtually all loading screens – including moving through doors and walking up stairs and ladders – movement through the game’s iconic police station and other environments is far quicker and more exciting. What’s more, this speedier traversal makes the limited inventory – essential to creating a sense that you aren’t a superhero, that you’re vulnerable, that you must both plan ahead and be extremely cautious – more bearable, since getting back to a stash to switch out items no longer feels like such a slog.Perhaps most satisfying of all is the trick that Capcom’s designers have pulled off in making exploration both familiar and new. Having played the original Resident Evil 2 more times than I can remember, I went into the remake feeling as though I already knew all the locations I’d be visiting. And while much of what I expected was there, and where I thought it would be, locations have been expanded and slightly rearranged. Enemies don’t always show up where you remember them, keys aren’t where you might think, and puzzles are fresh and challenging.Add in a host of subtle but important quality-of-life improvements – maps provide much more information, including locations of items you’ve had to leave behind and types of locks and barriers you’ve encountered; and sorting through inventory and combining items has been simplified and made more intuitive – and you’ve got the great game that we remember made completely playable in the modern age.Of course, whether it will have the same appeal to a younger audience unacquainted with the play style of early Resident Evil games is an open question. I can’t clearly separate how much of my enjoyment of Resident Evil 2 can be attributed to smart, timeless game design and how much to the powerful nostalgia I felt from start to finish.Truth be told, though, at the moment I don’t much care. I’m still sailing high on the joy of re-experiencing one of my very favourite games in a new yet vigorously familiar way. I can’t wait to jump in for a second play-through. Postmedia is committed to maintaining a lively but civil forum for discussion and encourage all readers to share their views on our articles. Comments may take up to an hour for moderation before appearing on the site. We ask you to keep your comments relevant and respectful. We have enabled email notifications—you will now receive an email if you receive a reply to your comment, there is an update to a comment thread you follow or if a user you follow comments. Visit our Community Guidelines for more information and details on how to adjust your email settings. 365 Bloor Street East, Toronto, Ontario, M4W 3L4 © 2023 Financial Post, a division of Postmedia Network Inc. All rights reserved. Unauthorized distribution, transmission or republication strictly prohibited.  This website uses cookies to personalize your content (including ads), and allows us to analyze our traffic. Read more about cookies here. By continuing to use our site, you agree to our Terms of Service and Privacy Policy. "
Resident Evil 2,Matt Cox,"Rock, Paper, Shotgun",https://www.rockpapershotgun.com/2019/01/22/resident-evil-2-review/,"Undying affectionCertain moments in Resident Evil 2 are imbued with a specific kind of awful. Moments when calculated slaughter gets drowned under a tide of undead flesh, all thought of eradication consumed by escape. There's this deep, prolonged pull of fear, punctured by sharp desperation. Moments when a dozen zombies and worse lumber between you and presumed safety, grabbing and biting and clawing as they drag you to the floor over and over again. It's messy. It's grim. It's kind of brilliant.It does strange things to your head, reviewing a remake of a survival horror game you know to be beloved. My first impulse was rejection.I know what you lot are like, you see. You lot, with your blood-tinted spectacles and habit of holding up outdated classics as modern masterpieces. ""Doom is still the best shooter of all time"", you'll say, forgetting that the aiming is weird and it doesn't have any grappling hooks. My first couple of hours with Resident Evil 2 reminded me of that, even though it's in proper third-person now and you no longer control a human tank from nightmarish corner angles.Horror games need to horrify, and those first hours did not. Nothing quells fear like familiarity, and nothing is more familiar than a zombie. I know exactly what those chaps get up to. Ripping people in half, moaning, reanimating, lumbering - check check check check. My eyes glazed over as b-movie action was interspersed with b-movie cutscenes, my schlock tolerance not cut out for a hammy mix of over and under-acting.I ran down gloomy hallways, I got lost, I felt little but frustration. Raccoon City's police station was like a Gothic painting by numbers, only some of the numbers were stupid puzzles. 
 
There was one near the start that particularly jarred, with its naked insistence that I tap in a correct button sequence by trial and error. They're puzzles of the sort that provide little satisfaction for those that solve them quickly, and far too much anguish for those that don't. Another source of anguish was the limited inventory, which I refuse to regard as a worthwhile constraint. Lack of inventory space doesn’t generate interesting decisions. It generates tedious jogs back to the last magic box.I thought I was trapped in a game that was itself ensnared by the past. Then I met a licker.Nothing should be allowed to scuttle like a licker. Even if they were to just stick to the floor, which of course lickers do not. They're on the walls. They're on the ceiling. They're on your chest, gouging out chunks of precious torso. I hate them. They've got brains where they shouldn't, claws longer than your leg, tongues that... well, let's just not talk about the tongues. 
 
The point is, I thought Resident Evil's capacity to scare had been lost in a cloud of contrivances, perhaps blown in by the winds of time, perhaps there from the beginning. That licker was the first fella to prove me wrong. It wasn't the last.Where lickers taught me panic, the tyrant taught me dread. A slab of bulletproof marble, marching towards you with all the inevitability of death. You can run, you can hide, but you can never escape entirely. You'll still hear the pitter patter of oversized feet, clunking forwards to a beat that makes you want to puke at every dead end. You'll reach that central area, the one you'd assumed was an oasis of safety where nothing could follow. You'll be wrong.As the Evil grew Eviler, I grew paradoxically more comfortable. Not with the horrors inside the world, but with the task of navigating it: I stopped my thoughtless wandering, and shifted to targeted exploration. I made a proper study of the map, putting more work than I'm used to into learning my way around. I still struggled - and that's with the help of a map that changes colour when you've found every item in an area. A modern convenience, indispensable for a generation accustomed to arrow-following. 
 
I still got stuck, and I'm still not convinced that was always my fault. I spent 40 minutes trekking around one section, not realising the key to progress was literally on my person. Or it would have been, if I hadn't stuffed a crucial object into storage because of that needlessly small inventory. You heard me. NEEDLESS.Which brings us back to the story. It's poorly written, poorly acted schlock without a milligram of believability - though I'm conflicted about whether to hold that against it. I've come to see it as goofy set-dressing that often undercuts the menace, while - sometimes - contributing to the fun. It's hard not to laugh at a parent who seems comically uninterested in the safety of her child, or a cop who's worried about not having the authority to work with an FBI agent in the midst of a zombie apocalypse. 
 
That cop's called Leon, and he's the player character for one of two campaigns. They're disappointingly similar, taking you on near-identical tours of sewers, police stations and laboratories. Apart from the cutscenes, the main difference between them is a section where you play as one of the people you meet. I found the special section in Claire's campaign, she being the other protagonist and (one of) Leon's lazily insinuated love interests, far more effective. Playing as a child in a horror game might be a cheap trick, but it works.I do wish they'd stop screaming “you bastard” at the poor zombies. Especially you, Leon. Even though you do have the more satisfying weapon selection, with one gun in particular that pops heads oh-so pleasingly. Regular enemies go down in three or five headshots to a regular pistol, which is a neat way of wresting away control. It makes it hard to calculate the time or bullets needed to deal with an approaching mob, leading to the kind of panic I described earlier. Unless you break out Leon's lovely lighthawk. Then you get to enjoy an animation where you kill a zombie just as it lunges, shrugging off its freshly headless-corpse. 
 
That's where Resident Evil succeeds. Not in the drivel spouted from its character's mouths, but in the bullets spewed from their guns. Or better yet - the clicking of empty chambers, or the spine-chilling scratches of scrabbling overhead. I may hate lickers, but I'm also a little bit in love.You're not signed in!Create your ReedPop ID & unlock community features and much, much more!
Find out how we conduct our reviews by reading our review policy.    Get each day's biggest PC gaming stories delivered direct to your inbox.
Matt Cox

          Contributor
        
Please enable JavaScript to see comments.      

 The 25 best action games on PC to play in 2023                    


 10 games with brilliant zombie apocalypses                    


 You can now roll back Resident 2, 3 and 7 graphical upgrades to make mods work again                    


 Dead Space's return could be a remake and not a new game                    


 Resident Evil's Nemesis is coming to Dead By Daylight                    


 The Humble store is having a Halloween sale too                    


 Have You Played... Resident Evil 2 (the remake)?                    


 The 9 worst scientists in PC games                    



Review: 

 Minecraft Legends review: a colourful RTS limited by its own small ambitions                    



Review: 

 Nvidia GeForce RTX 4070 review: what a difference DLSS 3 makes                    



Review: 

 Wartales review: a grimy medieval fantasy RPG rife with emergent stories                    



Review: 

 Road 96: Mile 0 review: an unexpected but enjoyable mashup prequel                    



Review: 

 Everspace 2 review: noughties but nice                    



Review: 

 Wildfrost review: cute, compelling, and chaotic card battling                    



Review: 

 The Last Worker review: this dystopian satire on automated jobs rather labours its point                    



Review: 

 Crime Boss: Rockay City review: a baffling and incoherent Paydaylike                    
We've been talking, and we think that you should wear clothesTotal coincidence, but we sell some clothesRock Paper Shotgun is owned by Gamer Network Limited, a ReedPop company and subsidiary of Reed Exhibitions Limited.© 2023 Gamer Network Limited, Gateway House, 28 The Quadrant, Richmond, Surrey, TW9 1DN, United Kingdom, registered under company number 03882481.All rights reserved. No part of this website or its content may be reproduced without the copyright owner's permission."
